course_url,course_name,instructor_name,course_provider,course_level,course_certificate,course_subject,course_is_university,course_avg_rating,course_num_rating,course_institution,course_is_classroom,course_is_free,course_id,course_type,course_provider_url,description,duration,start_date,pricing,image_url,rating,is_free,language
https://www.classcentral.com/course/coding-stanford-university-automata-theory-376,Automata Theory,N/A,edX,advanced,False,Automata Theory,True,4,20,Stanford University,False,True,376,course,N/A,"Explore finite automata, context-free grammars, Turing machines, and intractable problems in this comprehensive study of theoretical computer science foundations.","7 weeks, 5-10 hours a week",On-Demand,Free Online Course (Audit),https://d3f1iyfxxz8i1e.cloudfront.net/courses/course_image/96b800e98632.png,4 out of 5 stars,Yes,English
https://www.classcentral.com/course/automata-system-validation-6825,System Validation: Automata and behavioural equivalences,N/A,Coursera,intermediate,True,Automata Theory,False,0,0,EIT Digital,False,True,6825,course,N/A,"Explore automata and behavioral equivalences for system validation. Learn to model and analyze system behavior, understand equivalences, and design structurally sound embedded systems.",4 hours 10 minutes,On-Demand,Free Online Course (Audit),https://d3f1iyfxxz8i1e.cloudfront.net/courses/course_image/8beaba48faf3.png,No rating available,Yes,English
https://www.classcentral.com/course/udemy-formal-languages-and-automata-theory-e-69998,Formal Languages and Automata Theory,N/A,Udemy,beginner,True,Automata Theory,False,0,0,,False,False,69998,course,N/A,"Introduction to Automata Theory, Languages and Computation",31 hours,On-Demand,Paid Course,https://d3f1iyfxxz8i1e.cloudfront.net/courses/course_image/6ffaf7e1f3a4.jpg,No rating available,No,English
https://www.classcentral.com/course/udemy-theory-of-automata-and-computation-69897,Theory of Automata and Computation,N/A,Udemy,beginner,True,Automata Theory,False,0,0,,False,False,69897,course,N/A,"Theory of Automata/Computation, Formal Languages, DFA, NFA, CFG, CFL, Pushdown Automata, Turing Machine, Undecidability",3 hours 28 minutes,On-Demand,Paid Course,https://d3f1iyfxxz8i1e.cloudfront.net/courses/course_image/9a1e1bd09748.jpg,No rating available,No,English
https://www.classcentral.com/classroom/youtube-computer-theory-of-automata-formal-languages-and-computation-47637,"Theory of Automata, Formal Languages and Computation","NPTEL, IIT Madras",YouTube,,False,Automata Theory,True,5,1,NPTEL,True,True,47637,course,N/A,"Explore automata theory, formal languages, and computation through grammars, finite state automata, pushdown automata, Turing machines, and advanced topics in theoretical computer science.",1 day 15 hours,On-Demand,Free Video,https://d3f1iyfxxz8i1e.cloudfront.net/courses/course_image/2b284f8052c7.jpg,5 out of 5 stars,Yes,English
https://www.classcentral.com/classroom/youtube-greibach-normal-form-gnf-and-conversion-of-context-free-grammar-to-gnf-in-automata-theory-toc-217102,Greibach Normal Form and Conversion of Context Free Grammar to GNF in Automata Theory,Sundeep Saradhi Kanthety,YouTube,,False,Automata Theory,False,5,1,Sundeep Saradhi Kanthety,True,True,217102,course,N/A,Explore Greibach Normal Form and learn how to convert context-free grammars to GNF. Gain insights into this important concept in automata theory and formal language processing.,27 minutes,On-Demand,Free Video,https://d3f1iyfxxz8i1e.cloudfront.net/courses/course_image/f6218035abab.jpg,5 out of 5 stars,Yes,English
https://www.classcentral.com/classroom/youtube-learning-automata-with-hankel-matrices-borja-balle-amazon-research-cambridge-141724,"Learning Automata with Hankel Matrices - Borja Balle, Amazon Research Cambridge",Alan Turing Institute,YouTube,,False,Automata Theory,False,0,0,Alan Turing Institute,True,True,141724,course,N/A,"Explore a unified framework for learning automata using Hankel matrices, covering query learning, spectral learning, and matrix completion algorithms with practical applications.",41 minutes,On-Demand,Free Video,https://d3f1iyfxxz8i1e.cloudfront.net/courses/course_image/a816508ab088.jpg,No rating available,Yes,English
https://www.classcentral.com/classroom/youtube-deterministic-finite-automata-137813,Deterministic Finite Automata,Ryan O'Donnell,YouTube,,False,Automata Theory,False,0,0,Ryan O'Donnell,True,True,137813,course,N/A,"Explore deterministic finite automata, their structure, and applications in computer science. Learn to construct DFAs, understand regular languages, and solve computational problems.",1 hour 21 minutes,On-Demand,Free Video,https://d3f1iyfxxz8i1e.cloudfront.net/courses/course_image/8e77ab345b15.jpg,No rating available,Yes,English
https://www.classcentral.com/classroom/youtube-great-ideas-in-theoretical-computer-science-finite-automata-spring-2015-137822,Great Ideas in Theoretical Computer Science: Finite Automata,Ryan O'Donnell,YouTube,,False,Automata Theory,False,0,0,Ryan O'Donnell,True,True,137822,course,N/A,"Explore finite automata and regular languages in theoretical computer science, covering DFAs, computation concepts, and language analysis techniques.",1 hour 19 minutes,On-Demand,Free Video,https://d3f1iyfxxz8i1e.cloudfront.net/courses/course_image/bdf6ac0bbb38.jpg,No rating available,Yes,English
https://www.classcentral.com/classroom/youtube-formal-languages-and-automata-for-reward-function-specification-and-efficient-reinforcement-learning-134439,Formal Languages and Automata for Reward Function Specification and Efficient Reinforcement Learning,Simons Institute,YouTube,,False,Automata Theory,False,0,0,Simons Institute,True,True,134439,course,N/A,"Explore formal languages and automata for specifying reward functions in reinforcement learning, focusing on Linear Temporal Logic and Reward Machines to address real-world RL challenges.",1 hour 24 minutes,On-Demand,Free Video,https://d3f1iyfxxz8i1e.cloudfront.net/courses/course_image/497def9974c3.jpg,No rating available,Yes,English
https://www.classcentral.com/classroom/youtube-fractal-dimensions-and-buechi-automata-168410,Fractal Dimensions and Büchi Automata,Fields Institute,YouTube,,False,Automata Theory,False,0,0,Fields Institute,True,True,168410,course,N/A,"Explore fractal dimensions and Büchi automata, delving into formal definitions, regular languages, and ω-languages. Discover applications in model theory and intriguing examples where dimensions diverge.",49 minutes,On-Demand,Free Video,https://d3f1iyfxxz8i1e.cloudfront.net/courses/course_image/40f281b86ab9.jpg,No rating available,Yes,English
https://www.classcentral.com/classroom/youtube-conversion-of-regular-expression-to-finite-automata-using-subset-method-in-automata-theory-toc-217104,Conversion of Regular Expression to Finite Automata Using Subset Method in Automata Theory,Sundeep Saradhi Kanthety,YouTube,,False,Automata Theory,False,0,0,Sundeep Saradhi Kanthety,True,True,217104,course,N/A,"Learn to convert regular expressions to finite automata using the subset method, covering NFA construction, epsilon transition removal, and DFA conversion in automata theory.",21 minutes,On-Demand,Free Video,https://d3f1iyfxxz8i1e.cloudfront.net/courses/course_image/265141ad3b61.jpg,No rating available,Yes,English
https://www.classcentral.com/classroom/youtube-conversion-of-finite-automata-to-re-using-state-eliminating-method-in-automata-theory-toc-217105,Conversion of Finite Automata to Regular Expression Using State Eliminating Method in Automata Theory,Sundeep Saradhi Kanthety,YouTube,,False,Automata Theory,False,0,0,Sundeep Saradhi Kanthety,True,True,217105,course,N/A,"Learn to convert finite automata to regular expressions using the state elimination method, a crucial technique in automata theory for simplifying complex systems.",28 minutes,On-Demand,Free Video,https://d3f1iyfxxz8i1e.cloudfront.net/courses/course_image/47dea1c773fb.jpg,No rating available,Yes,English
https://www.classcentral.com/classroom/youtube-conversion-of-finite-automata-to-regular-expression-using-ardens-method-in-automata-theory-toc-217106,Conversion of Finite Automata to Regular Expression Using Arden's Method in Automata Theory,Sundeep Saradhi Kanthety,YouTube,,False,Automata Theory,False,0,0,Sundeep Saradhi Kanthety,True,True,217106,course,N/A,Learn to convert finite automata to regular expressions using Arden's method in automata theory. Explore step-by-step process with examples to master this important concept in theoretical computer science.,21 minutes,On-Demand,Free Video,https://d3f1iyfxxz8i1e.cloudfront.net/courses/course_image/8f85bbe59941.jpg,No rating available,Yes,English
https://www.classcentral.com/classroom/youtube-plse-seminar-series-loris-d-antoni-the-power-of-symbolic-automata-253872,PLSE Seminar Series - The Power of Symbolic Automata,Paul G. Allen School,YouTube,,False,Automata Theory,False,0,0,Paul G. Allen School,True,True,253872,course,N/A,"Explores symbolic automata, their applications in program verification, and novel decision procedures for equivalence checking and minimization of these powerful automata operating over infinite alphabets.",1 hour 4 minutes,On-Demand,Free Video,https://d3f1iyfxxz8i1e.cloudfront.net/courses/course_image/f314ec6c5fab.jpg,No rating available,Yes,English
https://www.classcentral.com/classroom/youtube-narad-rampersad-an-introduction-to-walnut-lecture-1-328157,An Introduction to Walnut - Lecture 1,Centre International de Rencontres Mathématiques,YouTube,,False,Automata Theory,False,0,0,Centre International de Rencontres Mathématiques,True,True,328157,course,N/A,"Explore Walnut, a tool for automata-based decision procedures in number theory and combinatorics on words. Learn its applications and fundamental concepts.",1 hour 35 minutes,On-Demand,Free Video,https://d3f1iyfxxz8i1e.cloudfront.net/courses/course_image/774917d72a52.jpg,No rating available,Yes,English
https://www.classcentral.com/classroom/youtube-narad-rampersad-an-introduction-to-walnut-lecture-2-328161,An Introduction to Walnut - Lecture 2,Centre International de Rencontres Mathématiques,YouTube,,False,Automata Theory,False,0,0,Centre International de Rencontres Mathématiques,True,True,328161,course,N/A,"Explore Walnut, a tool for automata-based proofs in number theory and combinatorics. Delve into advanced techniques and applications in this comprehensive mathematical lecture.",1 hour 38 minutes,On-Demand,Free Video,https://d3f1iyfxxz8i1e.cloudfront.net/courses/course_image/dd92dbcc4725.jpg,No rating available,Yes,English
https://www.classcentral.com/classroom/youtube-on-partial-order-and-automata-techniques-for-analyzing-communication-305080,On Partial-Order and Automata Techniques for Analyzing Communication,Simons Institute,YouTube,,False,Automata Theory,False,0,0,Simons Institute,True,True,305080,course,N/A,"Explores verification and synthesis techniques for peer-to-peer and mailbox communication in concurrent programming, focusing on message-passing models and their applications in distributed systems.",36 minutes,On-Demand,Free Video,https://d3f1iyfxxz8i1e.cloudfront.net/courses/course_image/6585dad588bf.jpg,No rating available,Yes,English
https://www.classcentral.com/classroom/youtube-marco-caminati-challenges-in-formalising-recent-results-in-formal-language-theory-309786,Challenges in Formalising Recent Results in Formal Language Theory,Hausdorff Center for Mathematics,YouTube,,False,Automata Theory,False,0,0,Hausdorff Center for Mathematics,True,True,309786,course,N/A,"Explore challenges in formalizing recent results linking formal language theory and computational group theory, with insights on making proofs more amenable to formalization.",51 minutes,On-Demand,Free Video,https://d3f1iyfxxz8i1e.cloudfront.net/courses/course_image/23c24bac82df.jpg,No rating available,Yes,English
https://www.classcentral.com/classroom/youtube-jsalt-2023-team-presentation-weighted-finite-state-automata-linear-algebra-lucas-ondel-yang-339294,Weighted Finite State Automata and Linear Algebra - JSALT 2023 Team Presentation,"Center for Language & Speech Processing(CLSP), JHU",YouTube,,False,Automata Theory,False,0,0,"Center for Language & Speech Processing(CLSP), JHU",True,True,339294,course,N/A,Explore weighted finite state automata and linear algebra in speech and language processing through a comprehensive JSALT 2023 team presentation by Lucas Ondel Yang.,2 hours 36 minutes,On-Demand,Free Video,https://d3f1iyfxxz8i1e.cloudfront.net/courses/course_image/77d54fa3c1e9.jpg,No rating available,Yes,English
https://www.classcentral.com/classroom/youtube-st30-complete-multiparty-session-type-projection-with-automata-347521,Complete Multiparty Session Type Projection with Automata - ST30,ACM SIGPLAN,YouTube,,False,Automata Theory,False,0,0,ACM SIGPLAN,True,True,347521,course,N/A,"Explore efficient multiparty session type projection using automata. Learn sound, complete, and efficient techniques for verifying asynchronous communication protocols.",30 minutes,On-Demand,Free Video,https://d3f1iyfxxz8i1e.cloudfront.net/courses/course_image/9693541b0010.jpg,No rating available,Yes,English
https://www.classcentral.com/classroom/youtube-scheme-23-visualizing-why-nondeterministic-finite-state-automa-reject-347617,Visualizing Why Nondeterministic Finite-State Automata Reject,ACM SIGPLAN,YouTube,,False,Automata Theory,False,0,0,ACM SIGPLAN,True,True,347617,course,N/A,"Explore visual techniques for understanding rejection in nondeterministic finite-state automata, enhancing comprehension of complex computational concepts.",29 minutes,On-Demand,Free Video,https://d3f1iyfxxz8i1e.cloudfront.net/courses/course_image/f8c179b5af4d.jpg,No rating available,Yes,English
https://www.classcentral.com/classroom/youtube-popl-24-on-learning-polynomial-recursive-programs-347966,On Learning Polynomial Recursive Programs,ACM SIGPLAN,YouTube,,False,Automata Theory,False,0,0,ACM SIGPLAN,True,True,347966,course,N/A,"Explore P-finite automata, a generalization of weighted automata with polynomial transition weights. Learn about their polynomial-time learnability in Angluin's MAT exact learning model.",19 minutes,On-Demand,Free Video,https://d3f1iyfxxz8i1e.cloudfront.net/courses/course_image/5e54ec24118c.jpg,No rating available,Yes,English
https://www.classcentral.com/classroom/youtube-popl-24-parikh-s-theorem-made-symbolic-347988,Parikh's Theorem Made Symbolic - POPL'24,ACM SIGPLAN,YouTube,,False,Automata Theory,False,0,0,ACM SIGPLAN,True,True,347988,course,N/A,"Explore Parikh's Theorem for symbolic automata, learning efficient algorithms for handling large or infinite alphabets in language processing and constraint solving.",18 minutes,On-Demand,Free Video,https://d3f1iyfxxz8i1e.cloudfront.net/courses/course_image/e341b9f4b8f9.jpg,No rating available,Yes,English
https://www.classcentral.com/course/mind-machine-artificial-intelligence-17330,What is “the mind” and what is artificial intelligence?,N/A,Coursera,beginner,True,Artificial Intelligence,True,0,0,University of Colorado Boulder,False,True,17330,course,N/A,"In this course, we will explore the history of cognitive science and the way these ideas shape how we think of artificial cognition.",7 hours 40 minutes,On-Demand,Free Online Course (Audit),https://d3f1iyfxxz8i1e.cloudfront.net/courses/course_image/0a52c7a56514.jpg,No rating available,Yes,English
https://www.classcentral.com/course/system-validation-modal-formulas-7808,System Validation (3): Requirements by modal formulas,N/A,Coursera,advanced,True,Computer Science,False,0,0,EIT Digital,False,True,7808,course,N/A,"Aprenda a especificar requisitos formais para sistemas usando lógica modal e fórmulas fixas, permitindo análise automatizada e garantia de comportamento correto em sistemas embarcados.",3 hours 56 minutes,On-Demand,Free Online Course (Audit),https://d3f1iyfxxz8i1e.cloudfront.net/courses/course_image/429d0679bfce.png,No rating available,Yes,English
https://www.classcentral.com/classroom/youtube-computer-science-theory-of-computation-47562,Theory of Computation,"NPTEL, IIT Kanpur",YouTube,,False,Computer Science,True,4.75,4,NPTEL,True,True,47562,course,N/A,"Explore finite automata, regular languages, context-free grammars, and Turing machines. Learn about computational models, their properties, and fundamental concepts in theoretical computer science.",1 day 15 hours,On-Demand,Free Video,https://d3f1iyfxxz8i1e.cloudfront.net/courses/course_image/4a9163941761.jpg,5 out of 5 stars,Yes,English
https://www.classcentral.com/course/swayam-introduction-to-automata-languages-and-computation-12943,"Introduction to Automata, Languages and Computation","IIT Kharagpur, NPTEL",Swayam,,True,Automata Theory,True,0,0,"Indian Institute of Technology, Kharagpur",False,True,12943,course,N/A,"Automata, Languages and Computation have been an important part of the curriculum in computer science department for several decades.The automata theory is the study of abstract machines and theirapplication in solving computational problems",12 weeks,Finished,Free Online Course,https://d3f1iyfxxz8i1e.cloudfront.net/courses/course_image/dfc4cac53da6.jpg,No rating available,Yes,English
https://www.classcentral.com/classroom/youtube-continuity-rational-functions-michael-cadilhac-university-of-oxford-141757,"Continuity and Rational Functions - Michaël Cadilhac, University of Oxford",Alan Turing Institute,YouTube,,False,Rational Functions,False,0,0,Alan Turing Institute,True,True,141757,course,N/A,"Explore continuity in word-to-word functions and its connection to language classes. Delve into transducers and their role in computing continuous functions, with applications in automata theory.",47 minutes,On-Demand,Free Video,https://d3f1iyfxxz8i1e.cloudfront.net/courses/course_image/1894f9f0ea00.jpg,No rating available,Yes,English
https://www.classcentral.com/classroom/youtube-peter-lloyd-automata-theoretic-approach-to-modelling-consciousness-within-mental-monism-135781,Automata-Theoretic Approach to Modelling Consciousness Within Mental Monism,Models of Consciousness Conferences,YouTube,,False,Philosophy of Mind,False,0,0,Models of Consciousness Conferences,True,True,135781,course,N/A,"Automata-theoretic approach to modeling consciousness in mental monism, exploring constraints and implications for substrate-free models of the mind's structure and dynamics.",17 minutes,On-Demand,Free Video,https://d3f1iyfxxz8i1e.cloudfront.net/courses/course_image/edde2c009073.jpg,No rating available,Yes,English
https://www.classcentral.com/classroom/youtube-eced2200-course-review-lecture-part-3-aug-10-2012-138937,"Course Review Lecture Part 3 - Aug 10, 2012",Colin O'Flynn,YouTube,,False,Finite State Machine,False,0,0,Colin O'Flynn,True,True,138937,course,N/A,"Comprehensive review of digital logic concepts including flip-flops, registers, counters, and finite state machines. Covers design processes and practical applications in digital systems.",51 minutes,On-Demand,Free Video,https://d3f1iyfxxz8i1e.cloudfront.net/courses/course_image/2aec727c45a7.jpg,No rating available,Yes,English
https://www.classcentral.com/classroom/youtube-eced2200-digital-circuits-lecture-summary-finite-state-machines-138939,Digital Circuits Lecture - Summary - Finite State Machines,Colin O'Flynn,YouTube,,False,Finite State Machine,False,0,0,Colin O'Flynn,True,True,138939,course,N/A,"Comprehensive overview of Finite State Machines, covering problem understanding, diagram creation, state assignment, flip-flop selection, and implementation specifics for both Mealy and Moore machines.",25 minutes,On-Demand,Free Video,https://d3f1iyfxxz8i1e.cloudfront.net/courses/course_image/487f47159334.jpg,No rating available,Yes,English
https://www.classcentral.com/classroom/youtube-why-it-s-all-snake-oil-and-that-may-be-ok-pablo-breuer-152077,Why It's All Snake Oil - And That May Be Ok,BSidesLV,YouTube,,False,Security BSides,False,0,0,BSidesLV,True,True,152077,course,N/A,"Explore cybersecurity challenges, computational limitations, and the implications of ""snake oil"" solutions in modern technology and threat detection.",42 minutes,On-Demand,Conference Talk,https://d3f1iyfxxz8i1e.cloudfront.net/courses/course_image/a356f8eb3308.jpg,No rating available,No,English
https://www.classcentral.com/classroom/youtube-php-uk-conference-2017-karina-popova-real-time-communication-to-simplify-your-life-191240,Real Time Communication to Simplify Your Life,PHP UK Conference,YouTube,,False,PHP UK Conference,False,0,0,PHP UK Conference,True,True,191240,course,N/A,"Explore real-time communication in IoT projects, focusing on connectivity, scalability, and global distribution. Learn about SIM card management, security, and PHP-based use cases in various industries.",41 minutes,On-Demand,Conference Talk,https://d3f1iyfxxz8i1e.cloudfront.net/courses/course_image/c2d15150c2e5.jpg,No rating available,No,English
https://www.classcentral.com/classroom/youtube-growing-neural-cellular-automata-162675,Growing Neural Cellular Automata,Yannic Kilcher,YouTube,,False,Cellular Automata,False,0,0,Yannic Kilcher,True,True,162675,course,N/A,"Explore neural cellular automata that learn to grow complex patterns through local interactions, mimicking biological morphogenesis and self-organization in a fascinating, interactive model.",16 minutes,On-Demand,Free Video,https://d3f1iyfxxz8i1e.cloudfront.net/courses/course_image/54d4782c5138.jpg,No rating available,Yes,English
https://www.classcentral.com/classroom/youtube-a-relational-exploration-of-the-chomsky-hierarchy-by-daniel-friedman-and-william-byrd-2013-166051,A Relational Exploration of the Chomsky Hierarchy,Strange Loop Conference,YouTube,,False,Strange Loop Conference,False,0,0,Strange Loop Conference,True,True,166051,course,N/A,"Explore encoding automata and Turing Machines in miniKanren for relational programming. Learn to generate strings and associated data structures, gaining insights into the Chomsky Hierarchy and automata workings.",50 minutes,On-Demand,Conference Talk,https://d3f1iyfxxz8i1e.cloudfront.net/courses/course_image/c1d5cdb77a66.jpg,No rating available,No,English
https://www.classcentral.com/classroom/youtube-setstate-machine-michele-bertoli-235376,SetState Machine,React Conferences by GitNation,YouTube,,False,Conference Talks,False,0,0,React Conferences by GitNation,True,True,235376,course,N/A,Explore deterministic state management in React components using State Machines. Learn Automata theory basics and discover how to generate automated tests for more predictable applications.,28 minutes,On-Demand,Conference Talk,https://d3f1iyfxxz8i1e.cloudfront.net/courses/course_image/6c584a39f0f3.jpg,No rating available,No,English
https://www.classcentral.com/classroom/youtube-games-from-logic-and-automata-to-algorithms-1-180392,Games: From Logic and Automata to Algorithms,Simons Institute,YouTube,,False,Algorithms and Data Structures,False,0,0,Simons Institute,True,True,180392,course,N/A,"Explore the intersection of logic, automata, and algorithms through game theory, focusing on theoretical foundations and computational applications.",46 minutes,On-Demand,Free Video,https://d3f1iyfxxz8i1e.cloudfront.net/courses/course_image/6ab52472463c.jpg,No rating available,Yes,English
https://www.classcentral.com/classroom/youtube-reversible-d-dmensional-ca-over-the-ring-mathbb-z-m-and-some-applications-in-ergodic-theory-183604,Reversible D-Dimensional CA Over the Ring ZM and Some Applications in Ergodic Theory,ICTP Mathematics,YouTube,,False,Cellular Automata,False,0,0,ICTP Mathematics,True,True,183604,course,N/A,"Explore cellular automata on $\mathbf{Z}_p$ and $\mathbf{Z}_m$, covering invertibility, ergodic properties, and entropy concepts. Delve into measure-theoretic and topological entropy for 1D linear CA and $\mathbb{Z}^2$-actions.",59 minutes,On-Demand,Free Video,https://d3f1iyfxxz8i1e.cloudfront.net/courses/course_image/a8db6303817d.jpg,No rating available,Yes,English
https://www.classcentral.com/classroom/youtube-bsidessf-2016-why-it-s-all-snake-oil-and-that-may-be-ok-pablo-breuer-165185,Why It’s All Snake Oil – And That May Be OK,Security BSides San Francisco,YouTube,,False,Security BSides,False,0,0,Security BSides San Francisco,True,True,165185,course,N/A,"Explore the limitations of security products, understand computer science theorems, and learn to evaluate vendor claims for your organization's needs.",10 minutes,On-Demand,Conference Talk,https://d3f1iyfxxz8i1e.cloudfront.net/courses/course_image/1af71ffe7d83.jpg,No rating available,No,English
https://www.classcentral.com/classroom/youtube-text-search-protocols-with-simulation-based-security-255614,Text Search Protocols with Simulation Based Security,TheIACR,YouTube,,False,Cryptography,False,0,0,TheIACR,True,True,255614,course,N/A,"Explore text search protocols with simulation-based security, covering applications, automata encryption, and evaluation techniques for secure and efficient data retrieval.",22 minutes,On-Demand,Free Video,https://d3f1iyfxxz8i1e.cloudfront.net/courses/course_image/58cf689f5154.jpg,No rating available,Yes,English
https://www.classcentral.com/classroom/youtube-demo-cellular-automata-216992,Cellular Automata: Algorithmic Information Dynamics in Living Systems,Complexity Explorer,YouTube,,False,Cellular Automata,False,0,0,Complexity Explorer,True,True,216992,course,N/A,"Explore cellular automata, a computational model for complex systems, and their applications in studying causality and living systems from networks to cells.",21 minutes,On-Demand,Free Video,https://d3f1iyfxxz8i1e.cloudfront.net/courses/course_image/db1eb99302b0.jpg,No rating available,Yes,English
