course_url,course_name,instructor_name,course_provider,course_level,course_certificate,course_subject,course_is_university,course_avg_rating,course_num_rating,course_institution,course_is_classroom,course_is_free,course_id,course_type,course_provider_url,description,duration,start_date,pricing,image_url,rating,is_free,language
https://www.classcentral.com/classroom/youtube-towards-general-purpose-vision-insights-from-derek-hoiem-ftc2023-saiconference-323265,Towards General Purpose Vision: Insights from Multimodal AI Systems,SAIConference,YouTube,,False,Artificial Intelligence,False,0,0,SAIConference,True,True,323265,course,N/A,"Explore multimodal AI evolution, from GPT to Visual Programming. Gain insights on integrating text, images, and audio for advanced problem-solving in artificial intelligence systems.",20 minutes,On-Demand,Free Video,https://d3f1iyfxxz8i1e.cloudfront.net/courses/course_image/e02c2f43b97b.jpg,No rating available,Yes,English
https://www.classcentral.com/classroom/youtube-intro-to-pops-the-new-operator-family-in-touchdesigner-344177,Introduction to Point Operators (POPs) in TouchDesigner - The New GPU-Based Operator Family,The Interactive & Immersive HQ,YouTube,,False,Uncategorized,False,0,0,The Interactive & Immersive HQ,True,True,344177,course,N/A,"Explore TouchDesigner's new Point Operators (POPs) for GPU-based 3D data creation and modification. Learn core concepts, data types, primitives, rendering, instancing, and performance benefits.",23 minutes,On-Demand,Free Video,https://d3f1iyfxxz8i1e.cloudfront.net/courses/course_image/ffd5017340fd.jpg,No rating available,Yes,English
https://www.classcentral.com/classroom/youtube-generative-geometric-patterns-in-touchdesigner-344178,Generative Geometric Patterns in TouchDesigner,The Interactive & Immersive HQ,YouTube,,False,Uncategorized,False,0,0,The Interactive & Immersive HQ,True,True,344178,course,N/A,Create stunning geometric patterns using instancing and post-effects in TouchDesigner. Learn to customize results by adjusting parameters and exploring different instancing techniques.,22 minutes,On-Demand,Free Video,https://d3f1iyfxxz8i1e.cloudfront.net/courses/course_image/53dd6b56c6de.jpg,No rating available,Yes,English
https://www.classcentral.com/course/mit-ocw-ec-s01-internet-technology-in-local-and-global-communities-spring-2005-summer-2005-292286,Internet Technology in Local and Global Communities,N/A,MIT OpenCourseWare,,False,Object-oriented programming,True,0,0,Massachusetts Institute of Technology,False,True,292286,course,N/A,"Explore programming, internet technology, and entrepreneurship through MIT's innovative approach to integrating IT education in African schools, emphasizing hands-on learning and community projects.",On-Demand,Free Online Course,N/A,https://d3f1iyfxxz8i1e.cloudfront.net/courses/course_image/647202763d51.jpg,No rating available,No,English
https://www.classcentral.com/classroom/youtube-using-the-logger-comp-in-touchdesigner-344189,Using the Logger COMP in TouchDesigner,The Interactive & Immersive HQ,YouTube,,False,Uncategorized,False,0,0,The Interactive & Immersive HQ,True,True,344189,course,N/A,"Explore TouchDesigner's new Logger COMP for efficient event logging and debugging. Learn core functionality, parameters, and Python methods through practical examples applicable to larger projects.",28 minutes,On-Demand,Free Video,https://d3f1iyfxxz8i1e.cloudfront.net/courses/course_image/6f6e3e18ad43.jpg,No rating available,Yes,English
https://www.classcentral.com/classroom/youtube-glitchy-trails-with-glsl-in-touchdesigner-344202,Glitchy Trails with GLSL in TouchDesigner - Creating and Manipulating Feedback Effects,The Interactive & Immersive HQ,YouTube,,False,Uncategorized,False,0,0,The Interactive & Immersive HQ,True,True,344202,course,N/A,"Create glitchy trailing feedback effects using GLSL in TouchDesigner. Convert ShaderToy code, modify for TouchDesigner, and enhance with built-in tools for unique visual results.",27 minutes,On-Demand,Free Video,https://d3f1iyfxxz8i1e.cloudfront.net/courses/course_image/69c0236a01dc.jpg,No rating available,Yes,English
https://www.classcentral.com/classroom/youtube-using-ai-image-generation-in-touchdesigner-344205,Using AI Image Generation in TouchDesigner,The Interactive & Immersive HQ,YouTube,,False,Uncategorized,False,0,0,The Interactive & Immersive HQ,True,True,344205,course,N/A,"Integrate AI image generation in TouchDesigner using OpenAI's Python library. Learn setup, Python control, and real-time image generation for enhanced visual projects.",34 minutes,On-Demand,Free Video,https://d3f1iyfxxz8i1e.cloudfront.net/courses/course_image/4a9236301d88.jpg,No rating available,Yes,English
https://www.classcentral.com/course/udemy-oop-in-python-mpb-125296,OOP in Python,N/A,Udemy,intermediate,False,Object-oriented programming,False,0,0,,False,True,125296,course,N/A,"Master object-oriented programming in Python: create classes, implement inheritance, and leverage encapsulation for efficient, reusable code. Gain practical skills for solving real-world problems.",1-2 hours,On-Demand,Free Online Course,https://d3f1iyfxxz8i1e.cloudfront.net/courses/course_image/a9098cf66495.jpg,No rating available,Yes,English
https://www.classcentral.com/classroom/youtube-why-don-t-browser-dev-tools-understand-your-code-steven-schkolne-conf42-javascript-2023-346195,Why Don't Browser Dev Tools Understand Your Code? - Enhancing Web Development Workflows,Conf42,YouTube,,False,Web Development,False,0,0,Conf42,True,True,346195,course,N/A,Explore why browser dev tools struggle with code comprehension and discover innovative solutions for enhanced web development workflows.,32 minutes,On-Demand,Free Video,https://d3f1iyfxxz8i1e.cloudfront.net/courses/course_image/a11cf0afef7f.jpg,No rating available,Yes,English
https://www.classcentral.com/classroom/youtube-sle23-a-low-code-platform-for-systematic-component-oriented-language-composition-348061,A Low-Code Platform for Systematic Component-Oriented Language Composition,ACM SIGPLAN,YouTube,,False,Low-code development,False,0,0,ACM SIGPLAN,True,True,348061,course,N/A,"Explore a low-code platform for systematic language composition using visual interfaces and pre-built components, streamlining domain-specific language development and promoting reuse.",15 minutes,On-Demand,Free Video,https://d3f1iyfxxz8i1e.cloudfront.net/courses/course_image/4fed4002ee06.jpg,No rating available,Yes,English
https://www.classcentral.com/classroom/youtube-coqpl-24-a-diagram-editor-to-mechanize-categorical-proofs-347358,A Diagram Editor to Mechanize Categorical Proofs,ACM SIGPLAN,YouTube,,False,Uncategorized,False,0,0,ACM SIGPLAN,True,True,347358,course,N/A,"Explore a prototype diagram editor for mechanizing categorical proofs, enhancing the process of creating diagrammatic proofs in Coq and UniMath.",22 minutes,On-Demand,Free Video,https://d3f1iyfxxz8i1e.cloudfront.net/courses/course_image/b5f89b0f1963.jpg,No rating available,Yes,English
https://www.classcentral.com/classroom/youtube-live23-cellpond-spatial-programming-without-escape-347542,CellPond: Spatial Programming Without Escape,ACM SIGPLAN,YouTube,,False,Programming Language Design,False,0,0,ACM SIGPLAN,True,True,347542,course,N/A,"Explore spatial programming with CellPond, a novel approach that eliminates escape hatches and maximizes visual, interactive benefits.",44 minutes,On-Demand,Free Video,https://d3f1iyfxxz8i1e.cloudfront.net/courses/course_image/cd780f32c5fc.jpg,No rating available,Yes,English
https://www.classcentral.com/course/study-com-computer-science-109-introduction-to-pr-112131,Computer Science 109: Introduction to Programming,N/A,Study.com,,True,Object-oriented programming,False,0,0,,False,False,112131,course,N/A,"Learn fundamental programming concepts, data structures, and algorithms through engaging lessons and expert instruction, preparing you for further computer science studies.",16 hours 40 minutes,On-Demand,Paid Course,https://d3f1iyfxxz8i1e.cloudfront.net/courses/course_image/7a1f4bbc5bab.jpeg,No rating available,No,English
https://www.classcentral.com/classroom/youtube-live23-paw-a-programmable-and-visual-audio-workstation-347543,PAW: A Programmable and Visual Audio Workstation,ACM SIGPLAN,YouTube,,False,Uncategorized,False,0,0,ACM SIGPLAN,True,True,347543,course,N/A,"Explore a prototype bridging digital audio workstations and live coding, combining visual interfaces with programmable music creation for enhanced flexibility and creativity.",31 minutes,On-Demand,Free Video,https://d3f1iyfxxz8i1e.cloudfront.net/courses/course_image/ad87fb5157e0.jpg,No rating available,Yes,English
https://www.classcentral.com/classroom/youtube-onward-bridging-the-syntax-semantics-gap-of-programming-347741,Bridging the Syntax-Semantics Gap in Programming - A Novel Programming-by-Demonstration Approach,ACM SIGPLAN,YouTube,,False,Programming Languages,False,0,0,ACM SIGPLAN,True,True,347741,course,N/A,"Explore a novel programming-by-demonstration paradigm that bridges the syntax-semantics gap, enabling intuitive and visual program creation without learning complex syntax.",27 minutes,On-Demand,Free Video,https://d3f1iyfxxz8i1e.cloudfront.net/courses/course_image/12501503f0c0.jpg,No rating available,Yes,English
https://www.classcentral.com/classroom/youtube-beginning-your-journey-with-ai-art-340487,Beginning Your Journey with AI Art,Toronto Machine Learning Series (TMLS),YouTube,,False,Generative Art,False,0,0,Toronto Machine Learning Series (TMLS),True,True,340487,course,N/A,Explore AI art creation using accessible tools and visual programming. Learn dataset manipulation and Cables.gl basics for innovative designs in motion graphics and data visualization.,2 hours 41 minutes,On-Demand,Free Video,https://d3f1iyfxxz8i1e.cloudfront.net/courses/course_image/f3f3dde31b05.jpg,No rating available,Yes,English
https://www.classcentral.com/classroom/youtube-interactive-edoardo-landi-in-touchdesigner-tutorial-344295,Interactive Edoardo Landi-Inspired Artwork in TouchDesigner Tutorial,The Interactive & Immersive HQ,YouTube,,False,Uncategorized,False,0,0,The Interactive & Immersive HQ,True,True,344295,course,N/A,"Create interactive optical illusions inspired by Edoardo Landi using TouchDesigner. Learn instancing, grid setup, and shape manipulation to develop cursor-responsive artwork that explores viewer perception.",20 minutes,On-Demand,Free Video,https://d3f1iyfxxz8i1e.cloudfront.net/courses/course_image/32a2db39113c.jpg,No rating available,Yes,English
https://www.classcentral.com/course/coursera-software-creation-version-control-debugging-object-design-296672,"Software Creation: Version Control, Debugging, Object Design",Coursera Instructor Network,Coursera,beginner,True,Object-oriented programming,False,0,0,Coursera Instructor Network,False,False,296672,course,N/A,"Learn essential software development skills: version control with Git, effective debugging techniques, and object-oriented design principles for creating robust and maintainable code.",1 hour 49 minutes,On-Demand,Paid Course,https://d3f1iyfxxz8i1e.cloudfront.net/courses/course_image/8345ea1efcdf.png,No rating available,No,English
https://www.classcentral.com/classroom/youtube-touchdesigner-s-data-model-tutorial-344296,TouchDesigner's Data Model - Understanding and Manipulating Data Across Operator Families,The Interactive & Immersive HQ,YouTube,,False,Uncategorized,False,0,0,The Interactive & Immersive HQ,True,True,344296,course,N/A,"Explore TouchDesigner's data model, learn to move data between operator families, and master non-destructive data manipulation techniques for advanced interactive and immersive projects.",16 minutes,On-Demand,Free Video,https://d3f1iyfxxz8i1e.cloudfront.net/courses/course_image/50fc63a220f9.jpg,No rating available,Yes,English
https://www.classcentral.com/classroom/youtube-generative-camera-paths-in-touchdesigner-tutorial-344299,Generative Camera Paths in TouchDesigner - Tutorial,The Interactive & Immersive HQ,YouTube,,False,Uncategorized,False,0,0,The Interactive & Immersive HQ,True,True,344299,course,N/A,Create dynamic camera paths in TouchDesigner using generative geometry for easy control and editing. Learn techniques for efficient animation without relying on keyframes.,15 minutes,On-Demand,Free Video,https://d3f1iyfxxz8i1e.cloudfront.net/courses/course_image/3f2580bad3b5.jpg,No rating available,Yes,English
https://www.classcentral.com/classroom/youtube-led-sculpture-content-creation-pipeline-in-touchdesigner-344262,LED Sculpture Content Creation Pipeline in TouchDesigner,The Interactive & Immersive HQ,YouTube,,False,Uncategorized,False,0,0,The Interactive & Immersive HQ,True,True,344262,course,N/A,Explore a creative pipeline for LED sculptural content using 2D images in TouchDesigner. Learn techniques to achieve artistic results while simplifying system complexity.,18 minutes,On-Demand,Free Video,https://d3f1iyfxxz8i1e.cloudfront.net/courses/course_image/855a3258aed2.jpg,No rating available,Yes,English
https://www.classcentral.com/course/coursera-core-java-foundations-295756,Core Java - Foundations,N/A,Coursera,beginner,True,Object-oriented programming,False,0,0,,False,True,295756,course,N/A,"Learn Java programming fundamentals and advanced concepts, including object-oriented principles, inheritance, interfaces, and exception handling. Develop practical applications and gain proficiency in Java development.",9 hours 14 minutes,On-Demand,Free Online Course (Audit),https://d3f1iyfxxz8i1e.cloudfront.net/courses/course_image/f755ad72a941.png,No rating available,Yes,English
https://www.classcentral.com/classroom/youtube-lesson-from-a-gig-using-a-zed-2i-camera-344264,Lessons from a Gig Using a ZED 2i Camera,The Interactive & Immersive HQ,YouTube,,False,Uncategorized,False,0,0,The Interactive & Immersive HQ,True,True,344264,course,N/A,Discover key insights from a real-world project using ZED 2i camera. Learn from mistakes and improve your interactive visual setups for live performances.,12 minutes,On-Demand,Free Video,https://d3f1iyfxxz8i1e.cloudfront.net/courses/course_image/831674811dde.jpg,No rating available,Yes,English
https://www.classcentral.com/classroom/youtube-generative-yayoi-kusama-in-touchdesigner-344268,Generative Yayoi Kusama-Inspired Art in TouchDesigner,The Interactive & Immersive HQ,YouTube,,False,Uncategorized,False,0,0,The Interactive & Immersive HQ,True,True,344268,course,N/A,"Explore generative art inspired by Yayoi Kusama using TouchDesigner. Learn to create immersive installations with Metaball SOPs, texturing, and dynamic effects.",18 minutes,On-Demand,Free Video,https://d3f1iyfxxz8i1e.cloudfront.net/courses/course_image/da66b38e3014.jpg,No rating available,Yes,English
https://www.classcentral.com/classroom/youtube-touchdesigner-s-new-installer-quick-guide-344276,TouchDesigner's New Installer Quick Guide,The Interactive & Immersive HQ,YouTube,,False,Uncategorized,False,0,0,The Interactive & Immersive HQ,True,True,344276,course,N/A,"Explore features of TouchDesigner's new installer, comparing Web and Full versions, and learn to modify installations for additional libraries.",14 minutes,On-Demand,Free Video,https://d3f1iyfxxz8i1e.cloudfront.net/courses/course_image/032830cefc98.jpg,No rating available,Yes,English
https://www.classcentral.com/course/python-the-georgia-institute-of-technology-comput-11472,Computing in Python IV: Objects & Algorithms,N/A,edX,beginner,True,Python,True,4.92523,107,Georgia Institute of Technology,False,True,11472,course,N/A,"Learn about recursion, search and sort algorithms, and object-oriented programming in Python.","5 weeks, 9-10 hours a week",On-Demand,Free Online Course (Audit),https://d3f1iyfxxz8i1e.cloudfront.net/courses/course_image/db83c67bd81f.jpg,5 out of 5 stars,Yes,English
https://www.classcentral.com/classroom/youtube-laser-cutting-patterns-in-touchdesigner-344280,Laser Cutting Patterns in TouchDesigner - From SOP Creation to SVG Export,The Interactive & Immersive HQ,YouTube,,False,Uncategorized,False,0,0,The Interactive & Immersive HQ,True,True,344280,course,N/A,"Create line patterns in TouchDesigner, export to SVG, and prepare for laser cutting. Learn techniques for designing, converting, and fabricating unique geometric designs.",17 minutes,On-Demand,Free Video,https://d3f1iyfxxz8i1e.cloudfront.net/courses/course_image/3432e3f49957.jpg,No rating available,Yes,English
https://www.classcentral.com/classroom/youtube-ai-portrait-installation-in-touchdesigner-344281,AI Portrait Installation with Motion Trigger in TouchDesigner,The Interactive & Immersive HQ,YouTube,,False,Uncategorized,False,0,0,The Interactive & Immersive HQ,True,True,344281,course,N/A,"Create an AI-powered interactive portrait installation using TouchDesigner, webcam input, and compute(r)ender. Generate unique images triggered by motion detection for immersive visual experiences.",19 minutes,On-Demand,Free Video,https://d3f1iyfxxz8i1e.cloudfront.net/courses/course_image/36540b97a1db.jpg,No rating available,Yes,English
https://www.classcentral.com/classroom/youtube-simple-pro-touchdesigner-tips-habits-344283,Simple PRO TouchDesigner Tips and Habits,The Interactive & Immersive HQ,YouTube,,False,Uncategorized,False,0,0,The Interactive & Immersive HQ,True,True,344283,course,N/A,Discover essential habits and tips to enhance your TouchDesigner workflow and become a more proficient user.,15 minutes,On-Demand,Free Video,https://d3f1iyfxxz8i1e.cloudfront.net/courses/course_image/509302347d74.jpg,No rating available,Yes,English
https://www.classcentral.com/classroom/youtube-oops-in-java-java-tutorials-for-beginners-great-learning-173488,OOPs in Java - Java Tutorials for Beginners,Great Learning,YouTube,,False,Object-oriented programming,False,5,1,Great Learning,True,True,173488,course,N/A,"Comprehensive introduction to object-oriented programming in Java, covering inheritance, polymorphism, and encapsulation. Ideal for beginners seeking to understand fundamental OOP concepts.",1 hour 6 minutes,On-Demand,Free Video,https://d3f1iyfxxz8i1e.cloudfront.net/courses/course_image/76aafab56e5e.jpg,5 out of 5 stars,Yes,English
https://www.classcentral.com/classroom/youtube-developments-in-code-building-tools-344914,Developments in Code-Building Tools for Wolfram Language,Wolfram,YouTube,,False,Wolfram Language,False,0,0,Wolfram,True,True,344914,course,N/A,"Explore new Wolfram Language tools for building code without complex syntax, making advanced functionality more accessible to newcomers and younger users.",30 minutes,On-Demand,Free Video,https://d3f1iyfxxz8i1e.cloudfront.net/courses/course_image/5e822602c584.jpg,No rating available,Yes,English
https://www.classcentral.com/classroom/youtube-visx-a-block-based-frontend-to-wolfram-language-344883,visX - A Block-Based Frontend to Wolfram Language,Wolfram,YouTube,,False,Wolfram Language,False,0,0,Wolfram,True,True,344883,course,N/A,"Explore visX, a block-based coding approach for Wolfram Language. Learn to organize code visually, enhancing understanding and leveraging the language's power and flexibility.",1 hour 29 minutes,On-Demand,Free Video,https://d3f1iyfxxz8i1e.cloudfront.net/courses/course_image/386a610da2f0.jpg,No rating available,Yes,English
https://www.classcentral.com/classroom/youtube-grasshopper-basics-with-david-rutten-90491,Grasshopper Basics with David Rutten,N/A,YouTube,,False,Rhinoceros 3D,False,0,0,,True,True,90491,course,N/A,"Learn Grasshopper fundamentals from its creator in this 13-part series. Covers interface, components, definitions, lofting, custom defaults, lists, and more. Perfect for beginners seeking a solid foundation.",1 hour 30 minutes,On-Demand,Free Video,https://d3f1iyfxxz8i1e.cloudfront.net/courses/course_image/3b65bb64267b.jpg,No rating available,Yes,English
https://catalog.foothill.edu/course-outlines/NCBS-449,FOUNDATIONS OF COMPUTER PROGRAMMING,N/A,California Community Colleges System,,False,Object-oriented programming,True,0,0,Foothill College,False,False,315042,course,N/A,"Explore object-oriented programming fundamentals, including data types, algorithms, and IDE usage. Master coding conventions, error handling, and software lifecycle concepts.",11 weeks,"23rd Sep, 2024",Paid Course,N/A,No rating available,No,English
https://www.classcentral.com/classroom/youtube-using-an-arduino-with-python-analog-voltage-meter-in-vpython-129599,Using an Arduino with Python - Analog Voltage Meter in VPython,Paul McWhorter,YouTube,,False,Arduino,False,0,0,Paul McWhorter,True,True,129599,course,N/A,"Learn to create an analog voltage meter using Arduino and Python, combining hardware interfacing with 3D visualization in vPython for real-time voltage measurement and display.",54 minutes,On-Demand,Free Video,https://d3f1iyfxxz8i1e.cloudfront.net/courses/course_image/d2b0f42c48b6.jpg,No rating available,Yes,English
https://www.classcentral.com/classroom/youtube-nature-of-code-continued-attraction-and-onto-chapter-3-108911,Nature of Code Continued - Attraction and onto Chapter 3,Coding Train,YouTube,,False,p5.js,False,0,0,Coding Train,True,True,108911,course,N/A,"Explore gravitational attraction and repulsion in coding, with hands-on examples and practical applications. Learn to simulate natural phenomena using p5.js and Processing.",2 hours 54 minutes,On-Demand,Free Video,https://d3f1iyfxxz8i1e.cloudfront.net/courses/course_image/299862175fb8.jpg,No rating available,Yes,English
https://www.classcentral.com/classroom/youtube-how-to-create-a-first-person-shooter-in-unreal-engine-5-128222,How to Create a First Person Shooter in Unreal Engine 5,UNF Games,YouTube,,False,Unreal Engine,False,0,0,UNF Games,True,True,128222,course,N/A,"Comprehensive guide to developing a First Person Shooter in Unreal Engine 5, covering tracing, shooting mechanics, SMG behavior, damage systems, and practical implementation techniques.",1 hour 56 minutes,On-Demand,Free Video,https://d3f1iyfxxz8i1e.cloudfront.net/courses/course_image/57730004902c.jpg,No rating available,Yes,English
https://www.classcentral.com/course/pluralsight-c-sharp-code-more-object-oriented-281737,Making Your C# 6 Code More Object-oriented,N/A,Pluralsight,intermediate,True,Object-oriented programming,False,0,0,,False,False,281737,course,N/A,"Leverage your understanding to produce object-oriented code, where objects will replace procedural code.",7 hours 5 minutes,On-Demand,Free Trial Available,https://d3f1iyfxxz8i1e.cloudfront.net/courses/course_image/0ea47a7ef153.jpg,No rating available,Yes,English
https://www.classcentral.com/classroom/youtube-custom-tilemap-in-unity-with-saving-and-loading-level-editor-130342,Custom Tilemap in Unity with Saving and Loading - Level Editor,Code Monkey,YouTube,,False,Unity,False,0,0,Code Monkey,True,True,130342,course,N/A,"Learn to create a custom tilemap with saving and loading functionality in Unity, enabling easy level design and sharing. Covers grid system implementation, visual elements, and data persistence.",26 minutes,On-Demand,Free Video,https://d3f1iyfxxz8i1e.cloudfront.net/courses/course_image/e3e2a28b70c1.jpg,No rating available,Yes,English
https://www.classcentral.com/classroom/youtube-home-assistant-node-red-install-plus-examples-130432,Home Assistant Node-RED Install Plus Examples,Tech Tutorials - David McKone,YouTube,,False,Node-RED,False,0,0,Tech Tutorials - David McKone,True,True,130432,course,N/A,"Learn to install, configure, and use Node-RED with Home Assistant for visual home automation. Create rules, troubleshoot, and explore practical examples to simplify your smart home setup.",1 hour 15 minutes,On-Demand,Free Video,https://d3f1iyfxxz8i1e.cloudfront.net/courses/course_image/2b140c3d7efb.jpg,No rating available,Yes,English
https://www.classcentral.com/classroom/youtube-360-live-fusion-360-dynamo-studio-142976,Fusion 360 + Dynamo Studio,N/A,YouTube,,False,Autodesk Fusion 360,False,0,0,Autodesk,True,True,142976,course,N/A,"Explore visual programming to control parametric Fusion 360 models in this comprehensive workflow demonstration, covering Dynamo Studio integration, surface manipulation, and design parameter creation.",43 minutes,On-Demand,Free Video,https://d3f1iyfxxz8i1e.cloudfront.net/courses/course_image/5558ef7a6573.jpg,No rating available,Yes,English
https://www.classcentral.com/classroom/youtube-if-gaudi-had-a-cluster-by-max-grigorev-jen-carlile-166156,If Gaudí Had a Cluster,Strange Loop Conference,YouTube,,False,Strange Loop Conference,False,0,0,Strange Loop Conference,True,True,166156,course,N/A,"Explore a visual programming environment for architects, combining Gaudí's innovative spirit with modern distributed computing to revolutionize building design and unleash creative potential.",44 minutes,On-Demand,Conference Talk,https://d3f1iyfxxz8i1e.cloudfront.net/courses/course_image/d9c0c0a89d91.jpg,No rating available,No,English
https://www.classcentral.com/course/symfonycasts-screencast-oo-291061,Object Oriented Programming (Course 1),N/A,SymfonyCasts,,True,Object-oriented programming,False,0,0,,False,False,291061,course,N/A,"Learn object-oriented programming fundamentals by building a space battle application. Master classes, objects, methods, properties, visibility, type-hinting, and constructors through hands-on coding.",56 minutes,On-Demand,Paid Course,https://ccweb.imgix.net/https%3A%2F%2Fd3f1iyfxxz8i1e.cloudfront.net%2Fcourses%2Fcourse_image%2F58c9c2201a1b.png?auto=format&blur=200&cs=strip&fit=crop&h=380&ixlib=php-4.1.0&px=16&w=535&s=43dad6e81e916dc6be9c68ebe9d00562,No rating available,No,English
