course_url,course_name,instructor_name,course_provider,course_level,course_certificate,course_subject,course_is_university,course_avg_rating,course_num_rating,course_institution,course_is_classroom,course_is_free,course_id,course_type,course_provider_url,description,duration,start_date,pricing,image_url,rating,is_free,language
https://www.classcentral.com/classroom/youtube-vizir-a-domain-specific-graphical-language-for-authoring-and-operating-airport-automations-158795,Vizir - A Domain-Specific Graphical Language for Authoring and Operating Airport Automations,Association for Computing Machinery (ACM),YouTube,,False,ACM SIGCHI,False,0,0,Association for Computing Machinery (ACM),True,True,158795,course,N/A,"Explore Vizir, a graphical language for creating and managing airport automations. Learn about its design process, features, and guidelines for developing human-automation systems in air traffic control.",21 minutes,On-Demand,Conference Talk,https://d3f1iyfxxz8i1e.cloudfront.net/courses/course_image/b056b31874a7.jpg,No rating available,No,English
https://www.classcentral.com/classroom/youtube-algorithmic-3-d-modeling-language-modeling-and-visual-programming-by-michael-hoffer-197889,"Algorithmic 3-D Modeling, Language Modeling and Visual Programming",Devoxx,YouTube,,False,Devoxx,False,0,0,Devoxx,True,True,197889,course,N/A,"Explore visual and text-based programming for 3D modeling using VRL-Studio, an IDE that combines Java Reflection API and Groovy to generate interactive interfaces and streamline complex design processes.",32 minutes,On-Demand,Conference Talk,https://d3f1iyfxxz8i1e.cloudfront.net/courses/course_image/db20d2dca6bd.jpg,No rating available,No,English
https://www.classcentral.com/course/datacamp-introduction-to-object-oriented-programming-in-python-290309,Introduction to Object-Oriented Programming in Python,N/A,DataCamp,,True,Object-oriented programming,False,0,0,,False,False,290309,course,N/A,"Discover the fundamental concepts of object-oriented programming (OOP), building custom classes and objects!",3 hours,On-Demand,Free Trial Available,https://d3f1iyfxxz8i1e.cloudfront.net/courses/course_image/e693609f7534.png,No rating available,Yes,English
https://www.classcentral.com/classroom/youtube-java-for-education-using-snapcode-by-jeff-martin-197198,Java for Education Using SnapCode,Devoxx,YouTube,,False,Devoxx,False,0,0,Devoxx,True,True,197198,course,N/A,"Explore SnapCode: a visual Java learning environment with drag-and-drop blocks, smooth transition to code editing, and web publishing capabilities for an engaging educational experience.",28 minutes,On-Demand,Conference Talk,https://d3f1iyfxxz8i1e.cloudfront.net/courses/course_image/4e9884ac146d.jpg,No rating available,No,English
https://www.classcentral.com/classroom/youtube-holiday-special-2015-224523,Holiday Special - Coding a Virtual Christmas Tree,Let's Code Physics,YouTube,,False,Python,False,0,0,Let's Code Physics,True,True,224523,course,N/A,Create a virtual Christmas tree using VPython in this festive coding tutorial. Learn to apply physics concepts while spreading holiday cheer through programming.,16 minutes,On-Demand,Free Video,https://d3f1iyfxxz8i1e.cloudfront.net/courses/course_image/8b775b1618c6.jpg,No rating available,Yes,English
https://www.classcentral.com/classroom/youtube-vpython-for-beginners-33-trails-and-arrows-224434,VPython for Beginners - Trails and Arrows - Lecture 33,Let's Code Physics,YouTube,,False,Vpython,False,0,0,Let's Code Physics,True,True,224434,course,N/A,"Learn to enhance 3D animations in VPython by adding trails and arrows to objects, improving visualization and clarity. Ideal for beginners exploring this free animation library based on Python.",17 minutes,On-Demand,Free Video,https://d3f1iyfxxz8i1e.cloudfront.net/courses/course_image/864f07e90b9a.jpg,No rating available,Yes,English
https://www.classcentral.com/course/codecademy-learn-intermediate-python-3-object-ori-159762,Learn Intermediate Python 3: Object-Oriented Programming,N/A,Codecademy,intermediate,True,Object-oriented programming,False,0,0,,False,True,159762,course,N/A,"Master object-oriented programming in Python 3: inheritance, abstraction, encapsulation, and polymorphism. Represent real-world relationships and create multi-form classes in your code.",2 hours,On-Demand,Free Trial Available,N/A,No rating available,Yes,English
https://www.classcentral.com/classroom/youtube-beautiful-code-typography-and-visual-programming-peter-hilton-215411,Beautiful Code - Typography and Visual Programming,NDC Conferences,YouTube,,False,NDC Conferences,False,0,0,NDC Conferences,True,True,215411,course,N/A,"Explore innovative approaches to code presentation, examining typography, layout, and visual programming to enhance readability and challenge traditional coding paradigms.",49 minutes,On-Demand,Conference Talk,https://d3f1iyfxxz8i1e.cloudfront.net/courses/course_image/bfcae5ba6b13.jpg,No rating available,No,English
https://www.classcentral.com/classroom/youtube-lessons-learned-to-adopt-visual-programming-tool-node-red-to-iot-use-cases-kazuhito-yokoi-220293,Lessons Learned: Adopting Node-RED for IoT Use Cases,N/A,YouTube,,False,Node-RED,False,0,0,Linux Foundation,True,True,220293,course,N/A,"Explore Node-RED for IoT: architecture, performance, integration, and practical applications. Learn from real-world examples and community insights to enhance your visual programming skills.",39 minutes,On-Demand,Free Video,https://d3f1iyfxxz8i1e.cloudfront.net/courses/course_image/10eaa9e863da.jpg,No rating available,Yes,English
https://www.classcentral.com/course/pluralsight-javascript-es6-object-oriented-programming-297647,Object-oriented Programming in JavaScript - ES6,N/A,Pluralsight,beginner,True,Object-oriented programming,False,0,0,,False,False,297647,course,N/A,"Stay updated by learning about the latest upgrade to the JavaScript language--ES6, also known as ECMAScript 2015. In this course, you will learn how to develop software using many kinds of classes and modules.",2 hours 27 minutes,On-Demand,Free Trial Available,https://d3f1iyfxxz8i1e.cloudfront.net/courses/course_image/618f5ecd27f3.jpg,No rating available,Yes,English
https://www.classcentral.com/classroom/youtube-a-picture-worth-a-thousand-programmes-maggie-appleton-react-advanced-2021-235187,A Picture Worth a Thousand Programmes,React Conferences by GitNation,YouTube,,False,Conference Talks,False,0,0,React Conferences by GitNation,True,True,235187,course,N/A,"Explore alternative visual representations of React beyond linear text, uncovering hidden information and expanding understanding through metaphorical comparisons and visual programming concepts.",25 minutes,On-Demand,Conference Talk,https://d3f1iyfxxz8i1e.cloudfront.net/courses/course_image/f46275574f7c.jpg,No rating available,No,English
https://www.classcentral.com/classroom/youtube-try-swift-india-2017-swiftly-programming-robots-241272,Swiftly Programming Robots,try! Swift Conference,YouTube,,False,try! Swift Conference,False,0,0,try! Swift Conference,True,True,241272,course,N/A,"Explore Apple's Swift Playgrounds for robot control, its impact on robotics and education, and the evolving landscape of programmable robotics platforms with visual programming interfaces.",21 minutes,On-Demand,Conference Talk,https://d3f1iyfxxz8i1e.cloudfront.net/courses/course_image/2a631e0552e3.jpg,No rating available,No,English
https://www.classcentral.com/classroom/youtube-dethe-elza-introduction-to-waterbear-234927,Introduction to Waterbear,JSConf,YouTube,,False,JSConf,False,0,0,JSConf,True,True,234927,course,N/A,"Learn about Waterbear, a visual programming language inspired by Scratch. Explore its blocks-based approach and discover how it promotes computer literacy and active content creation.",24 minutes,On-Demand,Conference Talk,https://d3f1iyfxxz8i1e.cloudfront.net/courses/course_image/c695ab2250f1.jpg,No rating available,No,English
https://www.classcentral.com/course/linkedin-learning-php-object-oriented-programming-100434,PHP: Object-Oriented Programming,N/A,LinkedIn Learning,,True,Object-oriented programming,False,0,0,,False,False,100434,course,N/A,Learn how to use object-oriented programming principles in PHP.,3-4 hours,On-Demand,Free Trial Available,https://d3f1iyfxxz8i1e.cloudfront.net/courses/course_image/6a0a69847a2e.jpeg,No rating available,Yes,English
https://www.classcentral.com/classroom/youtube-ruth-john-martin-schuhfuss-and-matt-mckegg-live-js-jsconf-asia-2016-234194,Live - JS,JSConf,YouTube,,False,JSConf,False,0,0,JSConf,True,True,234194,course,N/A,"Immersive JavaScript-powered audiovisual performance featuring interactive music, visuals, and lights. Experience the creative fusion of web technologies and artistic expression.",33 minutes,On-Demand,Conference Talk,https://d3f1iyfxxz8i1e.cloudfront.net/courses/course_image/bc96b1101502.jpg,No rating available,No,English
https://www.classcentral.com/classroom/youtube-amy-cheng-recreate-masterpieces-of-modern-art-with-javascript-jsconf-iceland-2016-234222,Recreate Masterpieces of Modern Art with JavaScript,JSConf,YouTube,,False,JSConf,False,0,0,JSConf,True,True,234222,course,N/A,Explore JavaScript's artistic potential by recreating famous modern art pieces in the browser. Learn to manipulate visual elements and discover a new side of coding.,26 minutes,On-Demand,Conference Talk,https://d3f1iyfxxz8i1e.cloudfront.net/courses/course_image/999457cfd928.jpg,No rating available,No,English
https://www.classcentral.com/classroom/youtube-jason-frame-acceptable-in-the-80s-revisiting-microworlds-jsconf-eu-2013-234687,Acceptable in the 80s - Revisiting Microworlds,JSConf,YouTube,,False,JSConf,False,0,0,JSConf,True,True,234687,course,N/A,"Explore the revival of 80s microworlds in modern web browsers, showcasing a hybrid visual programming environment for creating versatile, reusable computational canvases across various disciplines.",28 minutes,On-Demand,Conference Talk,https://d3f1iyfxxz8i1e.cloudfront.net/courses/course_image/877fae7a614b.jpg,No rating available,No,English
https://www.classcentral.com/classroom/youtube-a-visual-interactive-programming-environment-244713,A Visual Interactive Programming Environment,EuroPython Conference,YouTube,,False,EuroPython,False,0,0,EuroPython Conference,True,True,244713,course,N/A,"Explore a cutting-edge visual and interactive programming environment, enhancing code comprehension and development efficiency through innovative graphical representations.",55 minutes,On-Demand,Conference Talk,https://d3f1iyfxxz8i1e.cloudfront.net/courses/course_image/2fb9e75eea60.jpg,No rating available,No,English
https://www.classcentral.com/course/datacamp-programming-paradigm-concepts-157462,Programming Paradigm Concepts,N/A,DataCamp,,True,Object-oriented programming,False,0,0,,False,False,157462,course,N/A,"Explore a range of programming paradigms, including imperative and declarative, procedural, functional, and object-oriented programming.",2 hours,On-Demand,Free Trial Available,https://d3f1iyfxxz8i1e.cloudfront.net/courses/course_image/b87594f65655.png,No rating available,Yes,English
https://www.classcentral.com/classroom/youtube-the-larch-environment-python-programs-as-visual-interactive-documents-244423,The Larch Environment - Python Programs as Visual Interactive Documents,EuroPython Conference,YouTube,,False,EuroPython,False,0,0,EuroPython Conference,True,True,244423,course,N/A,"Explore Python programs as visual interactive documents using the Larch Environment, enhancing code comprehension and interactivity.",1 hour,On-Demand,Conference Talk,https://d3f1iyfxxz8i1e.cloudfront.net/courses/course_image/2df7545cdd02.jpg,No rating available,No,English
https://www.classcentral.com/classroom/youtube-yang-zhan-build-react-frontends-visually-at-react-live-online-conference-247439,Build React Frontends Visually,JSWORLD Conference,YouTube,,False,JSWorld Conference,False,0,0,JSWORLD Conference,True,True,247439,course,N/A,"Learn to build React frontends visually using tools like Plasmic. Explore UI builders, wireframing, styling, and code integration for efficient development and improved designer-developer collaboration.",29 minutes,On-Demand,Conference Talk,https://d3f1iyfxxz8i1e.cloudfront.net/courses/course_image/80d4caa57ac4.jpg,No rating available,No,English
https://www.classcentral.com/course/rebo-binario-22275,Rebo-binario,N/A,Coursera,beginner,True,Self Improvement,True,0,0,Universidad Autónoma de Madrid,False,True,22275,course,N/A,"Desarrolla habilidades de pensamiento computacional y creativo para resolver problemas, usando estrategias y herramientas digitales que fomentan la comprensión y apropiación de tecnologías informáticas.",9 hours 50 minutes,On-Demand,Free Online Course (Audit),https://d3f1iyfxxz8i1e.cloudfront.net/courses/course_image/55ed824a2f3b.png,No rating available,Yes,Spanish
https://www.classcentral.com/course/udemy-scratch-ile-cocuklar-icin-kodlama-122868,Scratch ile Çocuklar için Kodlama (2020),N/A,Udemy,beginner,False,Scratch,False,0,0,,False,True,122868,course,N/A,"Scratch ile çocuklar için kodlama öğrenin. Sürükle-bırak yöntemiyle animasyonlar, hikayeler ve oyunlar oluşturun. Algoritma, sistematik ve analitik düşünme becerilerini geliştirin.",1 hour 18 minutes,On-Demand,Free Online Course,https://d3f1iyfxxz8i1e.cloudfront.net/courses/course_image/d0817eda5a59.jpg,No rating available,Yes,Turkish
https://www.classcentral.com/course/symfonycasts-screencast-oo-ep3-291050,"OOP (course 3): Inheritance, Abstract Classes, Interfaces and other amazing things",N/A,SymfonyCasts,,True,Object-oriented programming,False,0,0,,False,False,291050,course,N/A,"Explore advanced OOP concepts like inheritance, abstract classes, and interfaces. Learn to leverage these powerful features to create flexible and robust object-oriented code.",56 minutes,On-Demand,Paid Course,https://ccweb.imgix.net/https%3A%2F%2Fd3f1iyfxxz8i1e.cloudfront.net%2Fcourses%2Fcourse_image%2F56f302ca771b.png?auto=format&blur=200&cs=strip&fit=crop&h=380&ixlib=php-4.1.0&px=16&w=535&s=083da9377c96389a48635ef5e2866919,No rating available,No,English
https://www.classcentral.com/course/windows-keshihua-chengxu-sheji-5599,Windows可视化程序设计,Xi'an Jiaotong University,Coursera,,True,Programming,True,0,0,Xi'an Jiaotong University,False,True,5599,course,N/A,本课程在前述课程基础上，进一步介绍C#的可视化程序设计。内容包括：Windows程序设计原理；控件，窗体；Windows GDI+系统；文件及目录的操作。通过本课程的学习，你将可以摆脱单调的控制台窗口，初步掌握使用C#开发Windows窗口应用程序的技巧，使你的应用程序界面更优美，使用更方便，与Windows操作系统的结合更紧密，实现更强大的功能。,20 hours 30 minutes,On-Demand,Free Online Course (Audit),https://d3f1iyfxxz8i1e.cloudfront.net/courses/course_image/cb7dd6b6dcac.png,No rating available,Yes,Chinese
https://www.classcentral.com/course/udemy-beatem-up-construct-2-35596,Crie Jogos em Construct 2: Beat'em up / Brawler,N/A,Udemy,intermediate,False,Game Development,False,0,0,,False,True,35596,course,N/A,Crie o seu próprio beat'em up (como Final Fight e Double Dragon) no motor de jogos de programação visual Construct 2!,7 hours,On-Demand,Free Online Course,https://d3f1iyfxxz8i1e.cloudfront.net/courses/course_image/496818f891a9.jpg,No rating available,Yes,Portuguese
https://www.classcentral.com/course/udemy-crea-tu-primer-videojuego-sin-codigo-con-sc-88694,Crea tu Primer videojuego sin Codigo con Scratch,N/A,Udemy,beginner,False,Game Development,False,0,0,,False,True,88694,course,N/A,aprenderás a construir tu primer videojuego en 2D de una manera fácil y divertida,1-2 hours,On-Demand,Free Online Course,https://d3f1iyfxxz8i1e.cloudfront.net/courses/course_image/480a88f43cd8.jpg,No rating available,Yes,Spanish
https://www.classcentral.com/course/udemy-unity-bolt-visual-scripting-para-videojuego-131065,Unity BOLT Visual Scripting para Videojuegos 2D y 3D,N/A,Udemy,beginner,True,Game Development,False,0,0,,False,False,131065,course,N/A,"Aprende DESDE CERO Programación Visual con Unity 2020 y BOLT, el nuevo sistema de Visual Scripting Videojuegos 2D",6 hours,On-Demand,Paid Course,https://d3f1iyfxxz8i1e.cloudfront.net/courses/course_image/484a57fa2e7a.jpg,No rating available,No,Spanish
https://www.classcentral.com/course/symfonycasts-screencast-oo-ep4-291046,"OOP (course 4): Static methods, Namespaces, Exceptions & Traits! Woh!",N/A,SymfonyCasts,,True,Object-oriented programming,False,0,0,,False,False,291046,course,N/A,"Explore advanced OOP concepts like static methods, namespaces, exceptions, and traits. Learn to leverage these powerful features for efficient and flexible code organization.",1 hour 16 minutes,On-Demand,Paid Course,https://ccweb.imgix.net/https%3A%2F%2Fd3f1iyfxxz8i1e.cloudfront.net%2Fcourses%2Fcourse_image%2F36187d17f874.png?auto=format&blur=200&cs=strip&fit=crop&h=380&ixlib=php-4.1.0&px=16&w=535&s=ca60e30ff2958c3d8a39241b858caf67,No rating available,No,English
https://www.classcentral.com/course/udemy-scratchjr-ile-kodluyorum-131011,ScratchJr İle Kodluyorum,N/A,Udemy,beginner,True,STEM,False,0,0,,False,False,131011,course,N/A,ScratchJr kullanarak eğlenceli oyunlar geliştirin (5-8 Yaş İçin Robotik-Kodlama),1-2 hours,On-Demand,Paid Course,https://d3f1iyfxxz8i1e.cloudfront.net/courses/course_image/350d90b55b46.jpg,No rating available,No,Turkish
https://www.classcentral.com/course/miriadax-introduccion-al-diseno-parametrico-en-arquitectura-14840,Introducción al Diseño Paramétrico en Arquitectura,N/A,Miríadax,,False,Computer Science,True,0,0,Universidad Anáhuac,False,True,14840,course,N/A,"Explora técnicas básicas de diseño paramétrico en Grasshopper, incluyendo manejo de información geométrica e integración de modelos de asoleamiento para optimizar el diseño arquitectónico.","4 weeks, 3 hours a week",On-Demand,Free Online Course,N/A,No rating available,Yes,Spanish
https://www.classcentral.com/course/openhpi-zusammenhaenge-entdecken-phaenomene-verstehen-programmieren-mit-etoys-5150,"Zusammenhänge entdecken, Phänomene verstehen: Programmieren mit Etoys",N/A,openHPI,,True,Programming,False,0,0,,False,True,5150,course,N/A,"Entdecke und verstehe komplexe Phänomene durch visuelle Programmierung mit Etoys. Erstelle Simulationen und Visualisierungen, um intuitive und nicht-intuitive Zusammenhänge zu erforschen und zu begreifen.",8 weeks,On-Demand,Free Online Course,N/A,No rating available,Yes,German
https://www.classcentral.com/course/symfonycasts-screencast-solid-291022,Write SOLID Code & Impress your Friends,N/A,SymfonyCasts,,True,Object-oriented programming,False,0,0,,False,False,291022,course,N/A,"Master SOLID principles for flexible, understandable object-oriented code. Learn practical applications of Single responsibility, Open-closed, Liskov substitution, Interface segregation, and Dependency inversion.",1 hour 54 minutes,On-Demand,Paid Course,https://ccweb.imgix.net/https%3A%2F%2Fd3f1iyfxxz8i1e.cloudfront.net%2Fcourses%2Fcourse_image%2F73aae0202e42.png?auto=format&blur=200&cs=strip&fit=crop&h=380&ixlib=php-4.1.0&px=16&w=535&s=5d3344bd16bc56a72b084e0c07b206ec,No rating available,No,English
https://www.classcentral.com/course/edx-procedural-modelling-17212,Procedural Modelling,N/A,edX,beginner,False,Computer Science,True,0,0,National University of Singapore,False,True,17212,course,N/A,"Learn to automate 3D model creation using procedural programming. Master data structures, control-flow, and custom functions while exploring geometric modeling and semantic data augmentation with Möbius Modeller.","5 weeks, 4-6 hours a week",Finished,Free Online Course (Audit),https://d3f1iyfxxz8i1e.cloudfront.net/courses/course_image/510e8ddbfec7.png,No rating available,Yes,English
https://www.classcentral.com/course/opensap-build-your-own-snap-workshop-13395,Build Your Own Snap! Workshop,N/A,openSAP,,False,STEM,False,0,0,,False,True,13395,course,N/A,"Learn to inspire young minds with Snap!, a visual programming language. Gain skills in creating beginner and advanced projects, understand key computer science concepts, and access workshop materials. Offered with Berkeley.",4 weeks,Finished,Free Online Course,N/A,No rating available,Yes,English
https://www.classcentral.com/course/linkedin-learning-first-look-scratch-3-0-76611,First Look: Scratch 3.0,N/A,LinkedIn Learning,,True,Scratch,False,0,0,,False,False,76611,course,N/A,"Discover the enhancements available in Scratch 3.0, the block-based visual programming language. This course compares 2.0 to 3.0 and shows how to use new and revised features.",Finished,Free Trial Available,N/A,https://d3f1iyfxxz8i1e.cloudfront.net/courses/course_image/2403535d77a6.jpeg,No rating available,No,English
https://www.classcentral.com/course/pluralsight-go-object-oriented-programming-263890,Object-oriented Programming with Go,N/A,Pluralsight,intermediate,True,Object-oriented programming,False,0,0,,False,False,263890,course,N/A,An Introductory course on how to write clean and concise code with the Object-oriented Programming with Go. Gain a solid understanding of Go software today!,1 hour 43 minutes,On-Demand,Free Trial Available,https://d3f1iyfxxz8i1e.cloudfront.net/courses/course_image/70295cdd7263.jpg,No rating available,Yes,English
https://www.classcentral.com/course/introduction-to-node-red-34128,Introduction to Node-red,N/A,Coursera,beginner,True,Node-RED,False,0,0,Coursera Project Network,False,False,34128,course,N/A,"Learn visual programming with Node-RED, an open-source tool for interconnecting IoT devices, APIs, and databases. Create a weather alert application while exploring key core nodes and fundamentals.",1 hour 40 minutes,Finished,Paid Course,https://d3f1iyfxxz8i1e.cloudfront.net/courses/course_image/8d77e7a242ec.png,No rating available,No,English
https://www.classcentral.com/course/pluralsight-python-3-classes-object-oriented-prog-201129,Classes and Object-oriented Programming in Python 3,N/A,Pluralsight,intermediate,True,Object-oriented programming,False,0,0,,False,False,201129,course,N/A,You might have heard the sentence which states that “everything is an object in Python”. This course will teach you how to approach the object-oriented paradigm in Python and how to implement it in practice.,2 hours 27 minutes,On-Demand,Free Trial Available,https://d3f1iyfxxz8i1e.cloudfront.net/courses/course_image/1e70e7e84f34.jpg,No rating available,Yes,English
https://www.classcentral.com/course/matlab-3396,Introduction to Programming with MATLAB,N/A,Coursera,beginner,True,MATLAB,True,4.82353,204,Vanderbilt University,False,True,3396,course,N/A,"This course teaches computer programming to those with little to no previous experience. It uses the programming system and language called MATLAB to do so because it is easy to learn, versatile and very useful for engineers and other professionals.",35 hours,On-Demand,Free Online Course (Audit),https://d3f1iyfxxz8i1e.cloudfront.net/courses/course_image/14989e14bf58.png,5 out of 5 stars,Yes,English
https://www.classcentral.com/course/pluralsight-c-sharp-10-object-oriented-programmin-200801,Object-oriented Programming in C# 10,N/A,Pluralsight,beginner,True,Object-oriented programming,False,0,0,,False,False,200801,course,N/A,C# is an object-oriented and strongly-typed language. This course will teach you how to design and build your classes and class hierarchies using OO principles.,4 hours 25 minutes,On-Demand,Free Trial Available,https://d3f1iyfxxz8i1e.cloudfront.net/courses/course_image/6ed65d883bc3.png,No rating available,Yes,English
https://www.classcentral.com/course/predictive-modeling-machine-learning-17129,Predictive Modeling and Machine Learning with MATLAB,MathWorks,Coursera,beginner,True,MATLAB,False,4.8481,79,MathWorks,False,True,17129,course,N/A,"Learn to build, evaluate, and optimize regression and classification models using MATLAB. Apply supervised machine learning workflows to real-world datasets and improve model performance through feature selection and hyperparameter tuning.",18 hours 52 minutes,On-Demand,Free Online Course (Audit),https://d3f1iyfxxz8i1e.cloudfront.net/courses/course_image/20799d7d17fc.jpg,5 out of 5 stars,Yes,English
https://www.classcentral.com/course/pluralsight-java-se-17-refactoring-solid-code-201519,Refactoring to SOLID Java SE 17 Code,N/A,Pluralsight,advanced,True,Object-oriented programming,False,0,0,,False,False,201519,course,N/A,"This course will teach you how to practically apply SOLID principles in Java applications to avoid
technical debt and build robust, loosely coupled systems that can evolve easily over time.",1 hour 57 minutes,On-Demand,Free Trial Available,https://d3f1iyfxxz8i1e.cloudfront.net/courses/course_image/053d7969553b.jpg,No rating available,Yes,English
https://www.classcentral.com/course/feature-engineering-matlab-17127,Data Processing and Feature Engineering with MATLAB,MathWorks,Coursera,intermediate,True,MATLAB,False,4.71154,52,MathWorks,False,True,17127,course,N/A,"In this course, you will build on the skills learned in Exploratory Data Analysis with MATLAB to lay the foundation required for predictive modeling.",20 hours 6 minutes,On-Demand,Free Online Course (Audit),https://d3f1iyfxxz8i1e.cloudfront.net/courses/course_image/b45c702ada6d.jpg,4.5 out of 5 stars,Yes,English
https://www.classcentral.com/course/pluralsight-object-oriented-php-classical-inheritance-model-297632,Object-oriented PHP: Classical Inheritance Model,N/A,Pluralsight,intermediate,True,Object-oriented programming,False,0,0,,False,False,297632,course,N/A,Training in the PHP object-oriented inheritance model.,2 hours 10 minutes,On-Demand,Free Trial Available,https://d3f1iyfxxz8i1e.cloudfront.net/courses/course_image/a4f442c6c17f.jpg,No rating available,Yes,English
